{
  "version": "1.2",
  "contract": {
    "artifact": "visual_direction_contract",
    "artifact_id": "ai-capital-flow-mortgage-ko/visual-direction",
    "revision": 1,
    "fingerprint": "sha256:7047616a43079b6e2e2403cfcefec81cc83ac13c3266091655b901c3ecd52421"
  },
  "inputs": {
    "timeline_sha256": "4331fde20bd7b8d9ccfbc7a6fd4b36b60b176fb4f9b363cca181b05d137f3e16",
    "lineage_sha256": "ca4648f1126a4a22b13ee4db37bf3a5c30001316bb6fce58b19f3315aca2f1c7",
    "binding_sha256": "879ab770435a770d19640b5e99ccf04557198f1f910dbd7ab47d98ed308f8aee",
    "visual_direction_sha256": "f929c81c55010331a77870603b88d98d1d795fada6106e407add3178c858d820"
  },
  "scenes": [
    {
      "scene_id": "SC009",
      "importance": "REQUIRED_LOCKED",
      "checks": [
        {
          "check_id": "SC009/Q01",
          "type": "ANCHOR_TIMING",
          "role": "REQUIRED",
          "target_ids": [
            "SC009/AN01"
          ],
          "result": "PASS",
          "detail": "EXACT at 0.5s",
          "time_seconds": 0.5
        },
        {
          "check_id": "SC009/Q02",
          "type": "ANCHOR_TIMING",
          "role": "REQUIRED",
          "target_ids": [
            "SC009/AN02"
          ],
          "result": "PASS",
          "detail": "EXACT at 5.06s",
          "time_seconds": 5.06
        },
        {
          "check_id": "SC009/Q03",
          "type": "ANCHOR_TIMING",
          "role": "REQUIRED",
          "target_ids": [
            "SC009/AN03"
          ],
          "result": "PASS",
          "detail": "EXACT at 8.36s",
          "time_seconds": 8.36
        },
        {
          "check_id": "SC009/Q04",
          "type": "ANCHOR_TIMING",
          "role": "REQUIRED",
          "target_ids": [
            "SC009/AN04"
          ],
          "result": "PASS",
          "detail": "EXACT at 13.76s",
          "time_seconds": 13.76
        },
        {
          "check_id": "SC009/Q05",
          "type": "ANCHOR_TIMING",
          "role": "REQUIRED",
          "target_ids": [
            "SC009/AN05"
          ],
          "result": "PASS",
          "detail": "EXACT at 13.76s",
          "time_seconds": 13.76
        },
        {
          "check_id": "SC009/Q06",
          "type": "ACTION_EXISTENCE",
          "role": "REQUIRED",
          "target_ids": [
            "SC009/A01"
          ],
          "result": "PASS",
          "detail": "lineage ['sc15'], operations in ['sc15']",
          "time_seconds": 5.06
        },
        {
          "check_id": "SC009/Q07",
          "type": "ACTION_EXISTENCE",
          "role": "REQUIRED",
          "target_ids": [
            "SC009/A02"
          ],
          "result": "PASS",
          "detail": "lineage ['sc16'], operations in ['sc16']",
          "time_seconds": 8.36
        },
        {
          "check_id": "SC009/Q08",
          "type": "ACTION_EXISTENCE",
          "role": "REQUIRED",
          "target_ids": [
            "SC009/A03"
          ],
          "result": "PASS",
          "detail": "lineage ['sc17'], operations in ['sc17']",
          "time_seconds": 13.76
        },
        {
          "check_id": "SC009/Q09",
          "type": "STATE_TRANSITION",
          "role": "REQUIRED",
          "target_ids": [
            "SC009/S0"
          ],
          "result": "PASS",
          "detail": "holds at scene start",
          "time_seconds": 0.0
        },
        {
          "check_id": "SC009/Q10",
          "type": "STATE_TRANSITION",
          "role": "REQUIRED",
          "target_ids": [
            "SC009/S1"
          ],
          "result": "PASS",
          "detail": "reached at 5.46s",
          "time_seconds": 6.26
        },
        {
          "check_id": "SC009/Q11",
          "type": "STATE_TRANSITION",
          "role": "REQUIRED",
          "target_ids": [
            "SC009/S2"
          ],
          "result": "PASS",
          "detail": "reached at 10.88s",
          "time_seconds": 12.08
        },
        {
          "check_id": "SC009/Q12",
          "type": "STATE_TRANSITION",
          "role": "REQUIRED",
          "target_ids": [
            "SC009/S3"
          ],
          "result": "PASS",
          "detail": "reached at 14.26s",
          "time_seconds": 15.46
        },
        {
          "check_id": "SC009/Q13",
          "type": "INVARIANT",
          "role": "REQUIRED",
          "target_ids": [
            "SC009/INV01"
          ],
          "result": "PASS",
          "detail": "holds after every sync group"
        },
        {
          "check_id": "SC009/Q14",
          "type": "INVARIANT",
          "role": "REQUIRED",
          "target_ids": [
            "SC009/INV02"
          ],
          "result": "PASS",
          "detail": "holds after every sync group"
        },
        {
          "check_id": "SC009/Q15",
          "type": "ORDER",
          "role": "REQUIRED",
          "target_ids": [
            "SC009/A01",
            "SC009/A02",
            "SC009/A03"
          ],
          "result": "PASS",
          "detail": "times [5.06, 8.36, 13.76]"
        },
        {
          "check_id": "SC009/Q16",
          "type": "PROHIBITED_SIMPLIFICATION",
          "role": "REQUIRED",
          "target_ids": [
            "SC009/A01"
          ],
          "result": "PASS",
          "detail": "runs at least 0.6s"
        },
        {
          "check_id": "SC009/Q17",
          "type": "PROHIBITED_SIMPLIFICATION",
          "role": "REQUIRED",
          "target_ids": [
            "SC009/A02"
          ],
          "result": "PASS",
          "detail": "runs at least 1.0s"
        },
        {
          "check_id": "SC009/Q18",
          "type": "PROHIBITED_SIMPLIFICATION",
          "role": "REQUIRED",
          "target_ids": [
            "SC009/A03"
          ],
          "result": "PASS",
          "detail": "runs at least 0.6s"
        },
        {
          "check_id": "SC009/Q19",
          "type": "CAUSAL_CHAIN",
          "role": "REQUIRED",
          "target_ids": [
            "SC009/CC01"
          ],
          "result": "PASS",
          "detail": "cause, intermediate reactions and effect all happen, in order"
        },
        {
          "check_id": "SC009/Q20",
          "type": "LAST_FRAME",
          "role": "REQUIRED",
          "target_ids": [
            "SC009/S3"
          ],
          "result": "PASS",
          "detail": "PASS: required state SC009/S3 holds at scene end; PASS: SC009/POOL visible at scene end; PASS: SC009/META visible at scene end; PASS: SC009/AMZN visible at scene end; PASS: SC009/YIELD_META visible at scene end; PASS: persistent state CAPITAL_FLOW.YIELD_PRESSURE at scene end; PASS: HOLD after 15.46s; PASS: held 1.60s of minimum 1.5s",
          "time_seconds": 17.06
        },
        {
          "check_id": "SC009/Q21",
          "type": "PERSISTENT_STATE",
          "role": "REQUIRED",
          "target_ids": [],
          "result": "PASS",
          "detail": "CAPITAL_FLOW hands YIELD_PRESSURE to SC010: holds at scene end",
          "time_seconds": 17.06
        },
        {
          "check_id": "SC009/Q22",
          "type": "PERSISTENT_STATE",
          "role": "REQUIRED",
          "target_ids": [],
          "result": "PASS",
          "detail": "persistent model CAPITAL_FLOW runs in the scene"
        },
        {
          "check_id": "SC009/Q23",
          "type": "BINDING",
          "role": "REQUIRED",
          "target_ids": [
            "SC009/A01"
          ],
          "result": "PASS",
          "detail": "deterministic_graphics: bound"
        },
        {
          "check_id": "SC009/Q24",
          "type": "BINDING",
          "role": "REQUIRED",
          "target_ids": [
            "SC009/A02"
          ],
          "result": "PASS",
          "detail": "deterministic_graphics: bound"
        },
        {
          "check_id": "SC009/Q25",
          "type": "BINDING",
          "role": "REQUIRED",
          "target_ids": [
            "SC009/A03"
          ],
          "result": "PASS",
          "detail": "deterministic_graphics: bound"
        },
        {
          "check_id": "SC009/Q26",
          "type": "BINDING",
          "role": "REQUIRED",
          "target_ids": [
            "SC009/E01"
          ],
          "result": "PASS",
          "detail": "deterministic_graphics: bound"
        },
        {
          "check_id": "SC009/Q27",
          "type": "BINDING",
          "role": "REQUIRED",
          "target_ids": [
            "SC009/E02"
          ],
          "result": "PASS",
          "detail": "deterministic_graphics: bound"
        },
        {
          "check_id": "SC009/Q28",
          "type": "BINDING",
          "role": "REQUIRED",
          "target_ids": [
            "SC009/E03"
          ],
          "result": "PASS",
          "detail": "deterministic_graphics: bound"
        },
        {
          "check_id": "SC009/Q29",
          "type": "BINDING",
          "role": "REQUIRED",
          "target_ids": [
            "SC009/S0"
          ],
          "result": "PASS",
          "detail": "deterministic_graphics: bound"
        },
        {
          "check_id": "SC009/Q30",
          "type": "BINDING",
          "role": "REQUIRED",
          "target_ids": [
            "SC009/S1"
          ],
          "result": "PASS",
          "detail": "deterministic_graphics: bound"
        },
        {
          "check_id": "SC009/Q31",
          "type": "BINDING",
          "role": "REQUIRED",
          "target_ids": [
            "SC009/S2"
          ],
          "result": "PASS",
          "detail": "deterministic_graphics: bound"
        },
        {
          "check_id": "SC009/Q32",
          "type": "BINDING",
          "role": "REQUIRED",
          "target_ids": [
            "SC009/S3"
          ],
          "result": "PASS",
          "detail": "deterministic_graphics: bound"
        },
        {
          "check_id": "SC009/Q33",
          "type": "PIXEL_CHANGE",
          "role": "SUPPORTING",